{
  "schemaVersion": 1,
  "module": "aerospace",
  "collection": {
    "id": "aerospace-safety-critical-software",
    "title": "Safety-Critical Aerospace Software"
  },
  "standardBaseline": {
    "family": "DO-178B/C airborne software assurance",
    "edition": "DO-178C with DO-178B legacy context",
    "status": "learning-baseline"
  },
  "generatedFrom": "content-source/aerospace/concepts.json",
  "concepts": [
    {
      "id": "aero-lifecycle-assurance-planning",
      "title": "Lifecycle Assurance and Planning",
      "module": "aerospace",
      "collection": "aerospace-safety-critical-software",
      "order": 1,
      "standard": {
        "family": "DO-178B/C airborne software assurance",
        "edition": "DO-178C with DO-178B legacy context",
        "parts": ["Lifecycle planning", "Assurance strategy"],
        "clauseRefs": ["Software planning process", "Lifecycle processes and data", "Independence and review strategy"]
      },
      "difficulty": "Foundation",
      "stage": 1,
      "systems": ["DO-178 Assurance", "Planning & Lifecycle", "Technical Leadership"],
      "summary": "Airborne software assurance begins by defining an executable lifecycle: what will be developed, which standards govern it, who performs and independently reviews each activity, what evidence is produced, and how readiness is measured.",
      "learningObjectives": [
        "Explain why planning is part of the assurance argument rather than an administrative preface.",
        "Connect software level, lifecycle activities, independence and evidence expectations.",
        "Build estimates and milestones around reviewable lifecycle data instead of code completion alone."
      ],
      "explanation": [
        "Airborne software assurance begins by defining an executable lifecycle: what will be developed, which standards govern it, who performs and independently reviews each activity, what evidence is produced, and how readiness is measured. A plan is credible only when responsibilities, inputs, outputs, entry criteria, exit criteria and configuration baselines can be applied by the actual team.",
        "Software level affects the rigor and independence expected from lifecycle activities, but the level is not a substitute for engineering judgment. The programme must still explain how requirements, design, code, verification, configuration management, quality assurance and certification data form one controlled evidence chain. Supplier boundaries, reused assets, generated code and qualified or unqualified tools must be visible in that chain.",
        "Estimation and tracking should therefore measure more than implementation progress. Mature tracking includes requirements maturity, review closure, verification procedure readiness, target and HIL availability, coverage status, problem-report ageing, baseline reproducibility, audit findings and certification-data completeness. These indicators expose assurance debt before it becomes a late programme crisis."
      ],
      "whyItMatters": [
        "A weak plan allows gaps in independence, evidence ownership or baseline control to remain hidden until formal reviews.",
        "Lifecycle-based tracking gives programme management an honest view of completion and residual risk."
      ],
      "inputs": ["System safety and software-level context", "Programme schedule and product scope", "Organizational processes and standards", "Supplier and tool strategy", "Certification and customer review expectations"],
      "activities": ["Define lifecycle processes and data", "Allocate roles and independence", "Plan reviews, audits and baselines", "Estimate verification and certification work", "Establish objective progress and readiness measures"],
      "outputs": ["Approved software plans and standards", "Lifecycle responsibility map", "Evidence and review schedule", "Resource and tool plan", "Readiness dashboard and escalation thresholds"],
      "automotiveExample": "An engine-control change appears small in source-code size, but affects a generated control model, target timing, HIL procedures, structural coverage and certification records. The software lead plans these linked activities and baselines before approving the implementation schedule.",
      "commonMistakes": ["Treating code complete as software complete", "Planning independence without naming competent reviewers", "Ignoring supplier or tool evidence until integration", "Tracking document count instead of lifecycle maturity", "Allowing schedule pressure to silently remove planned assurance activities"],
      "relatedConcepts": ["aero-requirements-traceability", "aero-configuration-certification", "aero-program-leadership-capa"],
      "linkedQuestions": ["A01-01", "A01-02", "A01-03", "A01-04", "A01-05", "A01-06", "A01-07", "A01-08", "A01-09", "A01-10"],
      "references": ["RTCA DO-178C / EUROCAE ED-12C", "Applicable programme software plans and standards"],
      "source": "content-source/aerospace/concepts.json#aero-lifecycle-assurance-planning"
    },
    {
      "id": "aero-requirements-traceability",
      "title": "Requirements, Derived Behaviour and Traceability",
      "module": "aerospace",
      "collection": "aerospace-safety-critical-software",
      "order": 2,
      "standard": {
        "family": "DO-178B/C airborne software assurance",
        "edition": "DO-178C with DO-178B legacy context",
        "parts": ["Requirements development", "Traceability"],
        "clauseRefs": ["High-level requirements", "Derived requirements", "Requirements verification and trace data"]
      },
      "difficulty": "Intermediate",
      "stage": 2,
      "systems": ["Requirements & Traceability", "DO-178 Assurance", "Engine Control & Diagnostics"],
      "summary": "Software requirements translate system intent into precise, verifiable behaviour while exposing every assumption, boundary condition and derived requirement that the software introduces.",
      "learningObjectives": ["Decompose system and customer needs into verifiable software requirements.", "Identify and control derived requirements and design assumptions.", "Use bidirectional traceability to reason about completeness, change impact and verification coverage."],
      "explanation": [
        "Software requirements translate system intent into precise, verifiable behaviour while exposing every assumption, boundary condition and derived requirement that the software introduces. A requirement must state externally observable behaviour, conditions, timing, accuracy, modes, invalid-data handling and failure response with enough precision for design and verification.",
        "Derived requirements arise when software decisions introduce behaviour or constraints not directly stated by the parent system requirement. Examples include initialization sequences, data-age limits, scheduling assumptions, range checks or degraded-mode transitions. Derived requirements are not defects, but they must be identified, justified, traced and communicated to the appropriate system and safety stakeholders.",
        "Traceability is an engineering control, not a hyperlink exercise. Forward traceability helps show that every approved requirement is implemented and verified. Reverse traceability helps show that every design element, code path and test has authorized intent. During change analysis, trace data identifies affected requirements, interfaces, models, code, tests, coverage results and certification records."
      ],
      "whyItMatters": ["Ambiguous or hidden behaviour propagates into design, code and tests, where it becomes expensive and difficult to justify.", "Traceability is the backbone of completeness, impact analysis and defensible problem closure."],
      "inputs": ["System and customer requirements", "System safety assumptions", "Interface-control data", "Control-law and diagnostic intent", "Operational modes and environmental constraints"],
      "activities": ["Decompose and clarify behaviour", "Identify derived requirements", "Define acceptance and robustness criteria", "Conduct requirements reviews", "Maintain bidirectional lifecycle traceability"],
      "outputs": ["Reviewed high-level software requirements", "Derived-requirement register and rationale", "Requirements trace matrix", "Review findings and closure evidence", "Verification-case allocation"],
      "automotiveExample": "A system requirement commands fuel scheduling from corrected shaft speed. Software design reveals that stale sensor data must force a controlled fallback after a bounded interval. The fallback threshold and transition are captured as derived requirements, communicated to system safety, traced to Stateflow logic and verified on HIL.",
      "commonMistakes": ["Writing requirements as implementation statements", "Hiding derived behaviour in models or code", "Using vague words such as quickly or normally", "Tracing only parent-to-child and not child-to-parent", "Closing review findings without updating affected verification cases"],
      "relatedConcepts": ["aero-lifecycle-assurance-planning", "aero-architecture-low-level-design", "aero-verification-hil", "aero-coverage-problem-closure"],
      "linkedQuestions": ["A02-01", "A02-02", "A02-03", "A02-04", "A02-05", "A02-06", "A02-07", "A02-08", "A02-09", "A02-10"],
      "references": ["RTCA DO-178C / EUROCAE ED-12C", "System requirements, safety analyses and interface-control documents"],
      "source": "content-source/aerospace/concepts.json#aero-requirements-traceability"
    },
    {
      "id": "aero-architecture-low-level-design",
      "title": "Software Architecture and Low-Level Design",
      "module": "aerospace",
      "collection": "aerospace-safety-critical-software",
      "order": 3,
      "standard": {
        "family": "DO-178B/C airborne software assurance",
        "edition": "DO-178C with DO-178B legacy context",
        "parts": ["Software architecture", "Low-level design"],